Type / Creator / Imprint,Publisher,Author,Title,Extra Title Info,Permanent Location,Call Number,Date,Status,Material Type,MMS ID
"Book By Centennial History Committee (Saint Anthony, Iowa) (Deep River, Iowa : Brennan Printing, [1981])","Saint Anthony, Iowa) (Deep River, Iowa : Brennan Printing, [1981])",Centennial History Committee,"Saint Anthony family receipt book and house-keeper's almanac : Saint Anthony, Iowa, Centennial, 1882-1982","[Saint Anthony Centennial History Committee, Saint Anthony, Iowa]",PARKS General Collection,TX715.2 M53 S2536x 1981,1981,Item in place,Book,990016335860102756
"Book By P.E.O. Sisterhood. Chapter BP (Indianola, Iowa) (Indianola, Iowa : Chapter BP, P.E.O.?, 1988.)","Indianola, Iowa) (Indianola, Iowa : Chapter BP, P.E.O.?, 1988.)",P.E.O. Sisterhood. Chapter BP,"Please enjoy ours : home cooking from Chapter BP, Indianola, Iowa.",,PARKS General Collection,TX715.2 M53 P65x 1988,1988,Item in place,Book,990016423700102756
"Book By St. Francis of Assisi Catholic Church (West Des Moines, Iowa) (Audubon, Iowa : Jumbo Jack's Cookbooks, 2001.)","West Des Moines, Iowa) (Audubon, Iowa : Jumbo Jack's Cookbooks, 2001.)",St. Francis of Assisi Catholic Church,"Burning sun and silver moon : a feast of St. Francis of Assisi Catholic Church, West Des Moines, Iowa.",,PARKS General Collection,TX715.2 M53 B87x 2001,2001,Item in place,Book,990016275990102756
"Book By Swedish Heritage Society (Swedesburg, Iowa) (Waverly, Iowa : G & R Publishing Co., 1996.)","Swedesburg, Iowa) (Waverly, Iowa : G & R Publishing Co., 1996.)",Swedish Heritage Society,"Va?lkommen till Swedesburg : recipes from the Swedish Heritage Society, Swedesburg, Iowa.",,PARKS General Collection,TX715.2 M53 V35x 1996,1996,Item in place,Book,990018677920102756
"Book By Boxholm United Methodist Church (Boxholm, Iowa) ([Ogden, Iowa] : [The Ogden Reporter], [1992].)","Boxholm, Iowa) ([Ogden, Iowa] : [The Ogden Reporter], [1992].)",Boxholm United Methodist Church,Through the years : Boxholm United Methodist Church.,,PARKS Cage: Ask at Main Desk,TX715.2 M53 T566x 1992,1992,Item in place,Book,990020047780102756
"Book By University of Iowa. Hospitals and Clinics. Volunteer Program. (Iowa City, Iowa : University of Iowa Hospitals and Clinics, Volunteer Program, [1983])","Iowa City, Iowa : University of Iowa Hospitals and Clinics, Volunteer Program, [1983])",University of Iowa. Hospitals and Clinics. Volunteer Program.,Ronald McDonald [House] cookbook,"University of Iowa Hospitals and Clinics, Volunteer Program.",PARKS General Collection,TX715.2 M53 R66x 1983,1983,Item in place,Book,990016196920102756
"Book By American Packaging Corporation (Story City, Iowa). (Audubon, Iowa : Jumbo Jack's Cookbooks, 1993.)","Story City, Iowa). (Audubon, Iowa : Jumbo Jack's Cookbooks, 1993.)",American Packaging Corporation,"Presenting recipes from American Packaging Corporation, Story City, Iowa.",,PARKS General Collection,TX715.2 M53 P7454x 1993,1993,Item in place,Book,990019151470102756
"Book By Iowa State Bank Friendship Club. ([Iowa] : Audubon, IA : Iowa State Bank Friendship Club ; 2008.)","[Iowa] : Audubon, IA : Iowa State Bank Friendship Club ; 2008.)",Iowa State Bank Friendship Club.,Friendship club cookbook. II,[Iowa State Bank Friendship Club].,PARKS General Collection,TX715.2 M53 F755x 2008,2008,Item in place,Book,990019674210102756
Book,,Book,SG cookbook.,,PARKS General Collection,TX715.2 M53 S4x,TX715.2 M53 S4x,Item in place,Book,990018548680102756
"Book By Daehler, John. (Kearney, NE : Cookbooks by Morris Press, [2000])","Kearney, NE : Cookbooks by Morris Press, [2000])","Daehler, John.",Recipes & remembrances : a collection of recipes from Maytag descendants near & far.,,PARKS General Collection,TX715.2 M53 R4528x 2000,2000,Item in place,Book,990015982360102756
"Book By Engman, Karen, (Waukee, Iowa : Iowa Jewish Historical Society, 33158 Ute Avenue, Waukee, Iowa 50263, [2015])","Waukee, Iowa : Iowa Jewish Historical Society, 33158 Ute Avenue, Waukee, Iowa 50263, [2015])","Engman, Karen,",Beyond matzo balls : celebrating 100 years of Jewish cooking in Iowa,"Karen Engman, editor.",PARKS General Collection,TX724 B49x 2015,2015,Item in place,Book,990019909670102756
"Book By Iowa Association of Electric Cooperatives. (Urbandale, Iowa : Iowa Association of Electric Cooperatives, 1992.)","Urbandale, Iowa : Iowa Association of Electric Cooperatives, 1992.)",Iowa Association of Electric Cooperatives.,Recipe roundup : an anniversary cookbook featuring favorite recipes from rural electric cooperative members,Iowa Association of Electric Cooperatives.,PARKS General Collection,TX715.2 M53 R433x 1992,1992,Item in place,Book,990016237610102756
"Book By Iowa 4-H Foundation. (Des Moines, Iowa : Successful Farming Books, Meredith Corp., [2009])","Des Moines, Iowa : Successful Farming Books, Meredith Corp., [2009])",Iowa 4-H Foundation.,"Hometown potluck favorites : serving sizes for all occasions, large or small.",,PARKS Spec Coll: Archives,TX693 H66x 2009,2009,Item in place,Book,990017861770102756
"Book (Davenport, Iowa : Quad-City Times, [1984])","Davenport, Iowa : Quad-City Times, [1984])",Book,Quad-City Times sinfully delicious 1984 cookbook,Quad-City Times.,PARKS General Collection,TX715.2 M53 Q335x 1984,1984,Item in place,Book,990016721290102756
"Book By Saint Cecilia Catholic Church (Ames, Iowa). Cookbook Committee. (Audubon, Iowa : Jumbo Jack's Cookbooks, 2005.)","Ames, Iowa). Cookbook Committee. (Audubon, Iowa : Jumbo Jack's Cookbooks, 2005.)",Saint Cecilia Catholic Church,Favorite recipes,Saint Cecilia Catholic Church [Cookbook Committee],PARKS General Collection,TX715.2 M53 F3839x 2005,2005,Item in place,Book,990015901810102756
"Book By Green's Maplewood Farm (Castalia, Iowa) (Castalia, Iowa : Green's Maplewood Farm, [between 1930 and 1940?].)","Castalia, Iowa) (Castalia, Iowa : Green's Maplewood Farm, [between 1930 and 1940?].)",Green's Maplewood Farm,"Sugaring time : maple syrup recipes with Green's pure maple syrup from Green's Maplewood Farm, Castalia, Iowa.",,PARKS Special Collections,TX767 M3 S84x 1930,1930,Item in place,Book,990019258420102756
"Book By Greenfield Business Women's Club. (Iowa Falls, Iowa : General Publishing and Binding, 1988.)","Iowa Falls, Iowa : General Publishing and Binding, 1988.)",Greenfield Business Women's Club.,Greenfield business women [cookbook].,,PARKS Special Collections,TX715.2.M53 G744x 1988,1988,Item in place,Book,9921538016902756
"Book By Faith Lutheran Church (Andover, Iowa). Cookbook Committee. (Audubon, Iowa : Jumbo Jack's Cookbooks, [1998])","Andover, Iowa). Cookbook Committee. (Audubon, Iowa : Jumbo Jack's Cookbooks, [1998])",Faith Lutheran Church,Fifty years of faith : 1949-1999,"[Cookbook Committee, Faith Lutheran Church]",PARKS General Collection,TX715.2 M53 F54x 1998,1998,Item in place,Book,990016247940102756
"Book (West Des Moines, Iowa : [Sacred Heart Home and School Association], [1985])","West Des Moines, Iowa : [Sacred Heart Home and School Association], [1985])",Book,Sacred Heart cookbook.,,PARKS Special Collections,TX715.2.M53 S2357x 1985,1985,Item in place,Book,9921561908802756
"Book By Green Hills Retirement Community (Ames, Iowa) Food Service. ([Ames, Iowa] : [Green Hills' Food Service], 1996.)","Ames, Iowa) Food Service. ([Ames, Iowa] : [Green Hills' Food Service], 1996.)",Green Hills Retirement Community,40 grandmas' cookbook,presented by Green Hills' Food Service.,PARKS Spec Coll: Archives,TX715.2 M53 A15x 1996,1996,Item in place,Book,990019384820102756
"Book By United Methodist Women (Onawa, Iowa), (Kansas City, Kansas : Bev-Ron Publishing Company, [1974])","Onawa, Iowa), (Kansas City, Kansas : Bev-Ron Publishing Company, [1974])",United Methodist Women,"What's cookin'? : in Onawa, Iowa",compiled by the United Methodist Women.,PARKS Special Collections,TX715.2 M53258x 1974,1974,Item in place,Book,9921481716202756
"Book By Oakley, Billie, (Shenandoah, Iowa : Home Talk Publications, Inc., 1989.)","Shenandoah, Iowa : Home Talk Publications, Inc., 1989.)","Oakley, Billie,",Golden memories cookbook,by Billie Oakley ; edited by Marje Boyer.,PARKS Special Collections,TX715.2.M53 O26x 1989,1989,Item in place,Book,9921533716902756
"Book By Sully Christian School (Sully, Iowa) (Iowa Falls, Iowa : General Publishing and Binding, 1970.)","Sully, Iowa) (Iowa Falls, Iowa : General Publishing and Binding, 1970.)",Sully Christian School,Sully Christian School Circle.,,PARKS General Collection,TX715.2 M53 S84x 1970,1970,Item in place,Book,990016312560102756
"Book ([Deep River, Iowa] : [Brennan Print. Co.], [1985])","[Deep River, Iowa] : [Brennan Print. Co.], [1985])",Book,"Hartwick community centennial cookbook, 1885-1985.",,PARKS General Collection,TX715.2 M53 H37x 1985,1985,Item in place,Book,990019110770102756
"Book (Audubon, Iowa : Jumbo Jack's Cookbooks, 1994.)","Audubon, Iowa : Jumbo Jack's Cookbooks, 1994.)",Book,Lehigh Public Library 1994 cookbook.,,PARKS General Collection,TX715.2 M53 L44x 1994,1994,Item in place,Book,990016273320102756
"Book By Wilbourne, Mabel. ([Bridgewater, IA (111 3rd St., Bridgewater 50837)] : Mail orders to : 1997.)","[Bridgewater, IA (111 3rd St., Bridgewater 50837)] : Mail orders to : 1997.)","Wilbourne, Mabel.",Bridgewater United Methodist cookbook,"[compiled by the cookbook committee: Mabel Wilbourne and Iris Evans, co-chairs].",PARKS General Collection,TX715.2 M53 B76x 1997,1997,Item in place,Book,990015940990102756
"Book By Oakley, Billie, (Shenandoah, Iowa : Target Productions, [1981])","Shenandoah, Iowa : Target Productions, [1981])","Oakley, Billie,",Billie Oakley's : everybody's an expert cookbook.,,PARKS Special Collections,TX715.2.M53 O259x 1981,1981,Item in place,Book,9921538016802756
"Book By Missman, Susan. (Audubon, Iowa : Junbo Jack's, 1992.)","Audubon, Iowa : Junbo Jack's, 1992.)","Missman, Susan.",The Armstrong Centennial cookbook of over 800 delicious recipes by 256 living and deceased residents or relatives,"compiled and edited by the 1993 Centennial Cookbook Committee, Susan Missman ... [and others].",PARKS General Collection,TX715.2 M53 A74x 1992,1992,Item in place,Book,990018504090102756
"Book By Troy United Methodist Church (Troy, Iowa), (Bloomfield, IA : Troy United Methodist Church, [1996])","Troy, Iowa), (Bloomfield, IA : Troy United Methodist Church, [1996])",Troy United Methodist Church,Troy United Methodist Church sesquicentennial cookbook : 1846-1996.,,PARKS Special Collections,TX715.2.M53 T76x 1996,1996,Item in place,Book,9921482512302756
"Book By Maxwell United Methodist Church (Maxwell, Iowa). Adult Fellowship. (Iowa Falls, Iowa : General Publishing and Binding, 1977.)","Maxwell, Iowa). Adult Fellowship. (Iowa Falls, Iowa : General Publishing and Binding, 1977.)",Maxwell United Methodist Church,My favorite cookbook 1977,compiled by the Adult Fellowship of the Maxwell United Methodist Church.,PARKS Special Collections,TX715.2 M53 M92x 1977,1977,Item in place,Book,9920275573702756
"Book By Salem Lutheran Church (Roland, Iowa) (Roland, Iowa : Nite Owl Printing, 2002.)","Roland, Iowa) (Roland, Iowa : Nite Owl Printing, 2002.)",Salem Lutheran Church,[Cookbook],"Salem Lutheran Church, Roland, Iowa.",PARKS General Collection,TX715.2 M53 C66717x 2002,2002,Item in place,Book,990016737610102756
"Book By Iowa Quilters Guild. (Deep River, Iowa : Brennan Printing, [1984])","Deep River, Iowa : Brennan Printing, [1984])",Iowa Quilters Guild.,Quilt Cottage cookbook,a publication of Iowa Quilters Guild.,PARKS General Collection,TX715.2 M53 Q55x 1984,1984,Item in place,Book,990016853530102756
"Book ([Place of publication not identified] : Prairie Press, Inc., 1973.)","[Place of publication not identified] : Prairie Press, Inc., 1973.)",Book,Kitchen-klatter cookbook,[Kitchen-klatter magazine].,PARKS Special Collections,TX715.2 M53 K587x 1973,1973,Item in place,Book,990016221050102756
"Book (Iowa Falls, Iowa : General Publishing and Binding, [1978])","Iowa Falls, Iowa : General Publishing and Binding, [1978])",Book,"Don't laugh, I'm a good cook","[L.P.N. class of Southeastern Community College, West Burlington, Iowa ...].",PARKS General Collection,TX715.2 M53 D655x 1978,1978,Item in place,Book,990016435180102756
"Book By United Church of Christ, Congregational (Ames, Iowa) (Ames, Iowa : United Church of Christ?, 2019.)","Ames, Iowa) (Ames, Iowa : United Church of Christ?, 2019.)","United Church of Christ, Congregational","""Comfort food"" : UCC men's fellowship cookbook",Ames United Church of Christ.,PARKS Cage: Ask at Main Desk,TX715.2 M53 M465x 2019,2019,Item in place,Book,9920839298602756
"Book (Audubon, Iowa : Audubon Publishing Co., [1982?])","Audubon, Iowa : Audubon Publishing Co., [1982?])",Book,Yale centennial cookbook 1882-1982.,,PARKS General Collection,TX715.2 M53 Y35x 1982,1982,Item in place,Book,990017374290102756
"Book By Union Park Methodist Church (Des Moines, Iowa). Woman's Society of Christian Service. Ruth Division. (Des Moines, Iowa : [Woman's Society of Christian Service?], [date of publication not identified])","Des Moines, Iowa). Woman's Society of Christian Service. Ruth Division. (Des Moines, Iowa : [Woman's Society of Christian Service?], [date of publication not identified])",Union Park Methodist Church,"The Ruth cook book : Union Park Methodist Church, Des Moines, Iowa",[compiled by the Ruth Division of the Woman's Society of Christian Service],PARKS Special Collections,TX715.2 M53 R88x,TX715.2 M53 R88x,Item in place,Book,990015245600102756
"Book ([Iowa City, Iowa] : [Old Capital Volunteers], [1978])","[Iowa City, Iowa] : [Old Capital Volunteers], [1978])",Book,Old Capitol cookbook : recipes,collected by Old Capital volunteers.,PARKS General Collection,TX715.2 M53 O432x 1978,1978,Item in place,Book,990015320580102756
"Book (Waverly, Iowa : G&R Publishing, 1995.)","Waverly, Iowa : G&R Publishing, 1995.)",Book,"Schmitz Family cookbook, 1995.",,PARKS General Collection,TX715.2 M53 S365x 1995,1995,Item in place,Book,990016432050102756
"Book By F. C. & A. Club (Colo, Iowa) (Audubon, Iowa : Jumbo Jack's Cookbooks, 1992.)","Colo, Iowa) (Audubon, Iowa : Jumbo Jack's Cookbooks, 1992.)",F. C. & A. Club,"F C & A Club : 25 yrs., 1967-1992.",,PARKS General Collection,TX715.2 M53 F33x 1992,1992,Item in place,Book,990016744870102756
"Book (Deep River, Iowa : Brennan Printing, 1993.)","Deep River, Iowa : Brennan Printing, 1993.)",Book,Making a miracle happen cookbook.,,PARKS General Collection,TX715.2 M53 M35x 1993,1993,Item in place,Book,990014683350102756
"Book By Smith, Kay Fenton, (Ames, IA : Sigler, [2022])","Ames, IA : Sigler, [2022])","Smith, Kay Fenton,",Baking blue ribbons : stories and recipes from the Iowa State Fair food competitions,Kay Fenton Smith with Carol McGarvey.,PARKS General Collection,TX715.2 M53 S628x 2022,2022,Item in place,Book,9921449312402756
"Book By Anamosa Community Hospital (Anamosa, Iowa). (Audubon, Iowa : Jumbo Jack's Cookbook Co., [1986])","Anamosa, Iowa). (Audubon, Iowa : Jumbo Jack's Cookbook Co., [1986])",Anamosa Community Hospital,[Cookbook],Anamosa Community Hospital.,PARKS General Collection,TX715.2 M53 C66714x 1986,1986,Item in place,Book,990016247900102756
"Book By Canter, Miriam. (Iowa City, Iowa : Penfield Press in cooperation with the Davenport Municipal Art Gallery, [1979])","Iowa City, Iowa : Penfield Press in cooperation with the Davenport Municipal Art Gallery, [1979])","Canter, Miriam.",The American Gothic cookbook,"compiled by Joan Liffring-Zug ; editing, graphic design and drawings by Esther Feske ; Miriam Canter, food editor.",PARKS General Collection,TX715.2 M53 A45x 1979,1979,Item in place,Book,990011547150102756
"Book By Quimby Fire Department (Quimby, Iowa) (Audubon, Iowa : Jumbo Jack's, 1996.)","Quimby, Iowa) (Audubon, Iowa : Jumbo Jack's, 1996.)",Quimby Fire Department,Spitfire anniversary cookbook.,,PARKS General Collection,TX715.2 M53 S68555x 1996,1996,Item in place,Book,990018673080102756
"Book By Des Moines Symphony Guild. (Des Moines, Iowa : Des Moines Symphony Guild, 1977.)","Des Moines, Iowa : Des Moines Symphony Guild, 1977.)",Des Moines Symphony Guild.,Of pipes and pans : the Des Moines Symphony cookbook.,,PARKS General Collection,TX715.2 M53 O3x 1977,1977,Item in place,Book,990016339840102756
"Book By First Congregational Church (Elkader, Iowa) (Waverly, Iowa : G & R Publishing, [2003?])","Elkader, Iowa) (Waverly, Iowa : G & R Publishing, [2003?])",First Congregational Church,Pilgrim's bounty,"First Congregational Church, Elkader, Iowa.",PARKS General Collection,TX715.2 M53 P55x 2003,2003,Item in place,Book,990014836260102756
"Book By Simpson College. Guild. (Iowa Falls, Iowa : General Publishing and Binding, 1975.)","Iowa Falls, Iowa : General Publishing and Binding, 1975.)",Simpson College. Guild.,Simpson guild cookbook,[Simpson CollegeGuild],PARKS General Collection,TX715.2 M53 S56x 1975,1975,Item in place,Book,990015564300102756
"Book (Iowa Falls, Iowa : General Publishing and Binding, 1988.)","Iowa Falls, Iowa : General Publishing and Binding, 1988.)",Book,KICD cookbook,KICD?,PARKS General Collection,TX715.2 M53 K53x 1988,1988,Item in place,Book,990018584280102756
"Book (Blakesburg, Iowa, [publisher not identified], 1980.)","Blakesburg, Iowa, [publisher not identified], 1980.)",Book,The home sweet homecoming cookbook.,,PARKS General Collection,TX715.2 M53 H6621x 1980,1980,Item in place,Book,990016287940102756
"Book By St. Patrick's Church (Monti, Iowa) (Iowa Falls, Iowa : General Publishing and Binding, [1980])","Monti, Iowa) (Iowa Falls, Iowa : General Publishing and Binding, [1980])",St. Patrick's Church,"St. Patrick's, Monti, 1855-1980.",,PARKS General Collection,TX715.2 M53 S254x 1980,1980,Item in place,Book,990016435200102756
"Book By Bethesda Lutheran Church (Ames, Iowa) (Oak Park, Ill. : Project Cuisine, 1987.)","Ames, Iowa) (Oak Park, Ill. : Project Cuisine, 1987.)",Bethesda Lutheran Church,Bethesda Lutheran Church cookbook,"Bethesda Lutheran Church, Ames, Iowa.",PARKS General Collection,TX715.2 M53 B4862x 1987,1987,Item in place,Book,990015982280102756
"Book (Audubon, Iowa : Jumbo Jack's Cookbooks, 2008.)","Audubon, Iowa : Jumbo Jack's Cookbooks, 2008.)",Book,Chelsea Community Building Cookbook.,,PARKS General Collection,TX715.2 M53 C5226x 2008,2008,Item in place,Book,990018677930102756
"Book By Ollie Baptist Church (Ollie, Iowa). (Iowa Falls, Iowa : General Publishing and Binding, 1977.)","Ollie, Iowa). (Iowa Falls, Iowa : General Publishing and Binding, 1977.)",Ollie Baptist Church,Not by bread alone,[The women of the Ollie Baptist Church],PARKS General Collection,TX715.2 M53 N683x 1977,1977,Item in place,Book,990016352150102756
"Book (Deep River, Iowa : Brennan Printing, 1995.)","Deep River, Iowa : Brennan Printing, 1995.)",Book,Emma's Tea Room cookbook.,,PARKS General Collection,TX715.2 M53 E46x 1995,1995,Item in place,Book,990019110810102756
"Book By Boone County Democratic Women (Boone, Iowa) (Lenexa, Kan. : Cookbook Publishers, Inc., 1984.)","Boone, Iowa) (Lenexa, Kan. : Cookbook Publishers, Inc., 1984.)",Boone County Democratic Women,Cookbook,compiled by Boone County Democratic Women.,PARKS General Collection,TX715.2 M53 C6678x 1984,1984,Item in place,Book,990015326400102756
"Book By Oregon Trail Days Committee (Eddyville, Iowa). (Deep River, Iowa : Brennan Printing, [1984])","Eddyville, Iowa). (Deep River, Iowa : Brennan Printing, [1984])",Oregon Trail Days Committee,Oregon Trail Days cookbook,[Oregon Trail Days Committee?],PARKS General Collection,TX715.2 M53 O73x 1984,1984,Item in place,Book,990016247920102756
"Book (Audubon, Iowa : Jumbo Jack's Cookbooks, 2003.)","Audubon, Iowa : Jumbo Jack's Cookbooks, 2003.)",Book,Pitzen family legacy cookbook.,,PARKS General Collection,TX715.2 M53 P58x 2003,2003,Item in place,Book,990015326430102756
"Book (Audubon, Iowa : Jumbo Jack's Cookbooks, 2001.)","Audubon, Iowa : Jumbo Jack's Cookbooks, 2001.)",Book,St. Lawrence Parish cookbook : 1995-2001.,,PARKS General Collection,TX715.2 M53 S2535x 2001,2001,Item in place,Book,990016273230102756
"Book By Giard Methodist Church (McGregor, Iowa) ([McGregor, Iowa] : [Giard Methodist Church?], 1962.)","McGregor, Iowa) ([McGregor, Iowa] : [Giard Methodist Church?], 1962.)",Giard Methodist Church,Country cooking cookbook,"Giard Methodist Church, McGregor, Iowa.",PARKS Special Collections,TX715.2 M53 C682x 1962,1962,Item in place,Book,990015230500102756
"Book By Lucas County Health Center (Chariton, Iowa) (Audubon, Iowa : Jumbo Jack's Cookbooks, 1998.)","Chariton, Iowa) (Audubon, Iowa : Jumbo Jack's Cookbooks, 1998.)",Lucas County Health Center,Lucas County Health Center cookbook.,,PARKS General Collection,TX715.2 M53 L83x 1998,1998,Item in place,Book,990016435170102756
"Book ([Ames, Iowa] : [City of Ames employees?], 1990.)","[Ames, Iowa] : [City of Ames employees?], 1990.)",Book,Depot cookbook.,,PARKS General Collection,TX715.2 M53 D47x 1990,1990,Item in place,Book,990016155890102756
"Book By Evangelical Covenant Church (Pomeroy, Iowa) (Iowa Falls, Iowa : General Publishing and Binding, 1973.)","Pomeroy, Iowa) (Iowa Falls, Iowa : General Publishing and Binding, 1973.)",Evangelical Covenant Church,Country kitchen favorites,"[compiled by the] women of Pomeroy Covenant Church, Pomeroy, Iowa.",PARKS General Collection,TX715.2 M53 C69x 1973,1973,Item in place,Book,990016303180102756
"Book ([Place of publication not identified] : [publisher not identified], [date of publication not identified])","[Place of publication not identified] : [publisher not identified], [date of publication not identified])",Book,Sioux City Gospel Mission cookbook,[Sioux City Gospel Mission].,PARKS General Collection,TX715.2 M53 S58x,TX715.2 M53 S58x,Item in place,Book,990018939030102756
"Book By Indian Hills Community College (Ottumwa, Iowa) ([Ottumwa, Iowa] : IHCC Printers.)","Ottumwa, Iowa) ([Ottumwa, Iowa] : IHCC Printers.)",Indian Hills Community College,Cookbook,IHCC (Indian Hills Community College).,PARKS General Collection,TX715.2 M53 C66713x,TX715.2 M53 C66713x,Item in place,Book,990016301110102756
"Book By Collegiate United Methodist Church (Ames, Iowa). Cookbook Committee. (Waverly, IA : G&R Publishing, [2013])","Ames, Iowa). Cookbook Committee. (Waverly, IA : G&R Publishing, [2013])",Collegiate United Methodist Church,Souper suppers 2013,Collegiate United Methodist Church Cookbook Committee.,PARKS General Collection,TX715.2 M53 S67x 2013,2013,Item in place,Book,990019577350102756
"Book By Lee County CowBelles (Lee County, Iowa) (Kansas City, Kan. : Circulation Service, Inc., 1974.)","Lee County, Iowa) (Kansas City, Kan. : Circulation Service, Inc., 1974.)",Lee County CowBelles,All beef cookbook,Lee County CowBelles.,PARKS Special Collections,TX715.2 M53 A433x 1974,1974,Item in place,Book,990016745430102756
"Book By Waldorf College Auxiliary. (Forest City, Iowa : Waldorf College, [date of publication not identified])","Forest City, Iowa : Waldorf College, [date of publication not identified])",Waldorf College Auxiliary.,Waldorf auxiliary cookbook,[Waldorf College Auxiliary],PARKS Special Collections,TX715.2 M53 W35x,TX715.2 M53 W35x,Item in place,Book,990014923820102756
"Book By Calvary Christian Reformed Church (Pella, Iowa) (Chicago, Ill. : Women's Clubs Publishing, [1970?])","Pella, Iowa) (Chicago, Ill. : Women's Clubs Publishing, [1970?])",Calvary Christian Reformed Church,Calvinette,Calvary Christian Reformed Church.,PARKS General Collection,TX715.2 M53 C357x 1970,1970,Item in place,Book,990016328830102756
"Book By Beulah Rebekah Lodge #24 (Jefferson, Iowa) ([Place of publication not identified] : [publisher not identified], [date of publication not identified])","Jefferson, Iowa) ([Place of publication not identified] : [publisher not identified], [date of publication not identified])",Beulah Rebekah Lodge #24,"FLT, family record book","[compiled by Beulah Rebekah Lodge #24, Jefferson, Iowa?]",PARKS Special Collections,TX715.2 M53 F58x,TX715.2 M53 F58x,Item in place,Book,990015077720102756
"Book By Black, Gertrude. ([Iowa] : Iowa State Grange, 1960.)","[Iowa] : Iowa State Grange, 1960.)","Black, Gertrude.",Look at these recipes now and discover the exciting secrets of the Subordinate and Pomona Lecturers of our Iowa State Grange,[compiled by Mrs. Arthur (Gertrude) Black].,PARKS Special Collections,TX715.2 M53 L664x 1960,1960,Item in place,Book,990019111760102756
"Book By First United Methodist Church (Denison, Iowa.) (Audubon, Iowa : Jumbo Jack's Cookbooks, 1994.)","Denison, Iowa.) (Audubon, Iowa : Jumbo Jack's Cookbooks, 1994.)",First United Methodist Church,Our daily bread. Volume II,"First United Methodist Church, Denison, Iowa.",PARKS General Collection,TX715.2 M53 O9745x 1994,1994,Item in place,Book,990017699500102756
"Book By Our Saviour Lutheran Church (Ackley, Iowa) (Ackley, Iowa : Our Saviour Lutheran Church, 1983.)","Ackley, Iowa) (Ackley, Iowa : Our Saviour Lutheran Church, 1983.)",Our Saviour Lutheran Church,Our Saviour's Lutheran [cookbook],,PARKS General Collection,TX715.2 M53 O972x 1983,1983,Item in place,Book,990014539890102756
"Book By Bristow Betterment (Bristow, Iowa) (Waverly, Iowa : G & R Pub. Co., 2000.)","Bristow, Iowa) (Waverly, Iowa : G & R Pub. Co., 2000.)",Bristow Betterment,Bristow 125th anniversary cookbook,Bristow Betterment.,PARKS General Collection,TX715.2 M53 B77x 2000,2000,Item in place,Book,990015977940102756
"Book By Gilmore City Bradgate School District (Iowa). (Iowa : [publisher not identified], [between 1980 and 2000])","Iowa). (Iowa : [publisher not identified], [between 1980 and 2000])",Gilmore City Bradgate School District,Good cook-book,[recipes and drawings] submitted by: G. C.-B. elementary students and staff and the Day Care Kids ; cover design by Katie Wallace.,PARKS Special Collections,TX715.2 M53 G6525x 1980,1980,Item in place,Book,990019072570102756
