Type / Creator / Imprint,Publisher,Author,Title,Extra Title Info,Permanent Location,Call Number,Date,Status,Material Type,MMS ID
"Book By Steenblock, G. L. (Iowa Falls, Iowa : General Publishing and Binding, 1976.)","Iowa Falls, Iowa : General Publishing and Binding, 1976.)","Steenblock, G. L.",Liberty,[compiled by Mrs. G.L. Steenblock].,PARKS General Collection,TX715.2 M53 L515x 1976,1976,Item in place,Book,990016403320102756
"Book By Mingo United Methodist Church (Mingo, Iowa). Searcher's Circle. (Lenexa, Kan. : Cookbook Publishers, 1984.)","Mingo, Iowa). Searcher's Circle. (Lenexa, Kan. : Cookbook Publishers, 1984.)",Mingo United Methodist Church,Mingo centennial community cook book.,,PARKS General Collection,TX715.2 M53 M56x 1984,1984,Item in place,Book,990016193450102756
"Book By Van Veen, Dorothy. (Oak Park, Ill. : Project Cuisine, [between 1980 and 1989?])","Oak Park, Ill. : Project Cuisine, [between 1980 and 1989?])","Van Veen, Dorothy.",Dorothy's family favorites,[compiled by Dorothy Van Veen?],PARKS General Collection,TX715.2 M53 D67x 1989,1989,Item in place,Book,990015773700102756
"Book By United Methodist Church (DeWitt, Iowa) (Welton, Iowa (o/o Leann Larsen, Box 12, Welton 52774) : [Distributed by the] Cookbook Committee, [1989])","DeWitt, Iowa) (Welton, Iowa (o/o Leann Larsen, Box 12, Welton 52774) : [Distributed by the] Cookbook Committee, [1989])",United Methodist Church,Special recipes from our hearts,"the United Methodist Church, DeWitt, Iowa.",PARKS General Collection,TX715.2 M53 S685x 1989,1989,Item in place,Book,990015941060102756
"Book By Haldy, Louise Leonhardt, (Waverly, Iowa : G & R Publishing, [2003?])","Waverly, Iowa : G & R Publishing, [2003?])","Haldy, Louise Leonhardt,",Die Haldy kinder.,,PARKS General Collection,TX715.2 M53 H35x 2003,2003,Item in place,Book,990014854560102756
"Book By Pharmacists Mutual Companies. SHARE Committee. (Audubon, Iowa : Jumbo Jack's Cookbooks, 2000.)","Audubon, Iowa : Jumbo Jack's Cookbooks, 2000.)",Pharmacists Mutual Companies. SHARE Committee.,"Pharmacists Mutual ""SHARE""ing their best",[Pharmacists Mutual Companies ; compiled by 2000 SHARE Committee],PARKS General Collection,TX715.2 M53 P53x 2000,2000,Item in place,Book,990016301220102756
"Book By Des Moines Symphony Guild. (Des Moines, Iowa (530 42nd Street, Des Moines 50312) : [Distributed by] Des Moines Symphony Office, [1990])","Des Moines, Iowa (530 42nd Street, Des Moines 50312) : [Distributed by] Des Moines Symphony Office, [1990])",Des Moines Symphony Guild.,FanFare : a presentation of fine foods,by the Des Moines Symphony Guild.,PARKS General Collection,TX715.2 M53 F36x 1990,1990,Item in place,Book,990015571130102756
"Book By Uker, Constance A. ([Dension, Iowa?] : Dark Horse Publications, 1998.)","[Dension, Iowa?] : Dark Horse Publications, 1998.)","Uker, Constance A.",Now you're cooking! : a food and nutrition learning tool with rated recipes for all from the beginning cook to the most advanced chef,Constance A. Uker.,PARKS General Collection,TX715.2 M53 U44x 1998,1998,Item in place,Book,990016301200102756
"Book By Tyer, Orma. (Iowa Falls, Iowa : General Publishing and Binding, 1971.)","Iowa Falls, Iowa : General Publishing and Binding, 1971.)","Tyer, Orma.",Gingham apron cooky jar,[compiled] by Orma Tyer.,PARKS General Collection,TX772 G56x 1971,1971,Item in place,Book,990016211420102756
"Book By Ray, Billie. (Des Moines, IA : Terrace Hill Society, [1981])","Des Moines, IA : Terrace Hill Society, [1981])","Ray, Billie.","A Taste of Terrace Hill : a collection of pictures, stories and recipes to give you a taste of Terrace Hill","[compiled by] Billie Ray, and others.",PARKS General Collection,TX715.2 M53 T3724x 1981,1981,Item in place,Book,990016429420102756
"Book By Larson, Charlotte, (West Union, Iowa : [no publisher specified], 1938.)","West Union, Iowa : [no publisher specified], 1938.)","Larson, Charlotte,","Fayette County Union first annual free cooking school : souvenir program, Avalon Theater, Thursday, April 7, 1938, West Union, Iowa",conducted by Miss Charlotte Larson.,PARKS Special Collections,TX715.2 M53 F39x 1938,1938,Item in place,Book,990018963720102756
"Book By Hunter, Jane. (Waverly, IA : G & R Publishing, [2000])","Waverly, IA : G & R Publishing, [2000])","Hunter, Jane.",O taste and see that the Lord is good!,[compiled] by Jane Hunter.,PARKS General Collection,TX715.2 M53 O17x 2000,2000,Item in place,Book,990016161050102756
"Book By Glenwood State Hopital-School. Foster Grandparent Club. ([Glenwood, Iowa] : [Foster Grandparent Club?], 1968.)","[Glenwood, Iowa] : [Foster Grandparent Club?], 1968.)",Glenwood State Hopital-School. Foster Grandparent Club.,"Food, fun & folklore","[compiled by] Foster Grandparent Club, Glenwood State Hospital-School.",PARKS Spec Coll: Oversized,TX715.2 M53 F662x 1968,1968,Item in place,Book,990015526090102756
"Book By Staskal, Kathy A. (Audubon, Iowa : Jumbo Jack's Cookbook Co, 1988.)","Audubon, Iowa : Jumbo Jack's Cookbook Co, 1988.)","Staskal, Kathy A.","Putting you first, that's the REC way : treasured and tasty recipes from your local rural electric cooperative","[Central Iowa Power Cooperative (CIPCO) ; Kathy A. Staskal, editor.]",PARKS General Collection,TX715.2 M53 P88x 1988,1988,Item in place,Book,990016424800102756
"Book By Lund, JoAnna M. (New York : Berkley Pub. Group, 1997.)","New York : Berkley Pub. Group, 1997.)","Lund, JoAnna M.",30 meals,30 minutes : a Healthy Exchanges cookbook / JoAnna M. Lund.,PARKS General Collection,RM237.7 L868x 1997,1997,Item in place,Book,990016737180102756
"Book By John L. Lewis Committee. (Iowa Falls, Iowa : General Publishing and Binding, 1983.)","Iowa Falls, Iowa : General Publishing and Binding, 1983.)",John L. Lewis Committee.,"Our best recipes, John L. Lewis Days",[John L. Lewis Committee],PARKS Special Collections,TX715.2 M53 O9744x 1983,1983,Item in place,Book,990017661010102756
"Book ([Rockwell City, Iowa?] : [Rockwell City Band?], [1970])","[Rockwell City, Iowa?] : [Rockwell City Band?], [1970])",Book,Symphony of flavors.,,PARKS Special Collections,TX715.2.M53 S96x 1970,1970,Item in place,Book,9921624516802756
"Book ([Shenandoah, IA] : Driftmier Co., 1984.)","[Shenandoah, IA] : Driftmier Co., 1984.)",Book,The Best of Kitchen-Klatter main dishes.,,PARKS Special Collections,TX715.2 M53 B474x 1984,1984,Item in place,Book,990018970740102756
"Book By Goedeken, Reye. (Oskaloosa, Iowa : William Penn College, Home Economics Department, [1982?])","Oskaloosa, Iowa : William Penn College, Home Economics Department, [1982?])","Goedeken, Reye.",Penn personalities pots and pans,"Wiliiam Penn College, Home Economics Department ; [compiled by Reye Goedeken.]",PARKS General Collection,TX715.2 M53 P46x 1982,1982,Item in place,Book,990016171190102756
"Book By Telephone Pioneers of America. Mason City Council. Women's Activity Committee. (Des Moines, Iowa : Service Bureau, N.W. Bell Telephone Co., printer, 1959.)","Des Moines, Iowa : Service Bureau, N.W. Bell Telephone Co., printer, 1959.)",Telephone Pioneers of America. Mason City Council. Women's Activity Committee.,Dial your delight,"[sponsored by Mason City Council of the Telephone Pioneers of America, Women's Activity Committee]",PARKS Special Collections,TX715.2 M53 D53x 1959,1959,Item in place,Book,990015423120102756
"Book By Rinderknecht, Eloise. ([West Des Moines, IA] : West Des Moines Historical Society, [1996])","[West Des Moines, IA] : West Des Moines Historical Society, [1996])","Rinderknecht, Eloise.",Specialties of the house,published by West Des Moines Historical Society.,PARKS General Collection,TX715 S74x 1996,1996,Item in place,Book,990016887450102756
"Book By American Lutheran Church Women (Onawa, IA). (Onawa, Iowa : Faith Lutheran Church, [1978])","Onawa, IA). (Onawa, Iowa : Faith Lutheran Church, [1978])",American Lutheran Church Women,Our daily bread.,,PARKS Special Collections,TX715.2.M53 O973x 1978,1978,Item in place,Book,9921515114502756
"Book By Dryer, Bette. (Audubon, Iowa : Jumbo Jack's Cookbooks, 2006-)","Audubon, Iowa : Jumbo Jack's Cookbooks, 2006-)","Dryer, Bette.",A lifetime in the kitchen,Bette Dryer.,PARKS General Collection,TX715.2 M53 L54x 2006,2006,Item in place,Book,990019579470102756
"Book ([Gladbrook, Iowa (Box 190, Gladbrook 50635)] : [Send orders to: Gladbrook Corn Carnival Corp., o/o Mary Lynne Bearden], [1997])","[Gladbrook, Iowa (Box 190, Gladbrook 50635)] : [Send orders to: Gladbrook Corn Carnival Corp., o/o Mary Lynne Bearden], [1997])",Book,"75th Corn Carnival, Gladbrook, IA.",,PARKS General Collection,TX715.2 M53 A163x 1997,1997,Item in place,Book,990015947470102756
"Book By Cerro Gordo County 4-H (Iowa). ([Cerro Gordo County, Iowa] : Cerro Gordo County 4-H, [1965])","Iowa). ([Cerro Gordo County, Iowa] : Cerro Gordo County 4-H, [1965])",Cerro Gordo County 4-H,World day of understanding recipes.,,PARKS Special Collections,TX725.A1 C47x 1965,1965,Item in place,Book,9921482514302756
"Book By Linn County Farm Bureau Women, (Marion, Iowa : Linn County Farm Bureau, 1964.)","Marion, Iowa : Linn County Farm Bureau, 1964.)","Linn County Farm Bureau Women,",Linn County Farm Bureau Women's favorite recipes,compiled by Agricultural Interests Committee.,PARKS Special Collections,TX715.2.M53 L595 1964,1964,Item in place,,9921136214202756
"Book (Iowa Falls, Iowa : General Publishing and Binding, 1977.)","Iowa Falls, Iowa : General Publishing and Binding, 1977.)",Book,Ottumwa cook book.,,PARKS General Collection,TX715.2 M53 O88x 1977,1977,Item in place,Book,990016156120102756
"Book By Tama County Porkettes. ([Place of publication not identified] : [publisher not identified], [1974])","[Place of publication not identified] : [publisher not identified], [1974])",Tama County Porkettes.,Cook book,Tama County Porkettes.,PARKS General Collection,TX715.2 M53 C667x 1974,1974,Item in place,Book,990018937640102756
"Book (Collierville, Tenn. : Fundcraft Publishing, Inc., [1988?])","Collierville, Tenn. : Fundcraft Publishing, Inc., [1988?])",Book,Cook book,Hunziker & Furman Realtors.,PARKS General Collection,TX715.2 M53 C66394x 1988,1988,Item in place,Book,990017121860102756
"Book (Collierville, Tenn. : Fundcraft Publishing, [1978])","Collierville, Tenn. : Fundcraft Publishing, [1978])",Book,Cook book,Hunziker & Furman Realtors.,PARKS General Collection,TX715.2 M53 C66235x 1978,1978,Item in place,Book,990016737830102756
"Book By Craven, Genevieve, (Grundy Center, Iowa : Grundy County Extension Service, [19--?])","Grundy Center, Iowa : Grundy County Extension Service, [19--?])","Craven, Genevieve,",Favorite recipes,Mrs. Genevieve Craven.,PARKS Special Collections,TX715.2 M53 F3813x 1900z,TX715.2 M53 F3813x 1900z,Item in place,Book,9920354990102756
"Book By Zidlicky, Pat, (Postville, IA : Taste of Postville, 2001.)","Postville, IA : Taste of Postville, 2001.)","Zidlicky, Pat,",Taste of Postville : commemorative book : ethnic recipes and more,[compiled by Pat Zidlicky].,PARKS General Collection,TX725 A1 T375x 2001,2001,Item in place,Book,9920304088002756
"Book (Marceline, Mo. : Walsworth Brothers, [1956])","Marceline, Mo. : Walsworth Brothers, [1956])",Book,Snack-time symphony,"presented by Band Mothers, Ackley, Iowa.",PARKS Special Collections,TX715.2 M53 S632x 1956,1956,Item in place,Book,990014982200102756
"Book (Shenandoah, Iowa : Driftmier Co., 1953.)","Shenandoah, Iowa : Driftmier Co., 1953.)",Book,Kitchen-Klatter cookie book.,,PARKS Special Collections,TX772 K58x 1953,1953,Item in place,Book,990015670290102756
"Book (Marceline, Mo. : R. Wallace Pischel, 1952.)","Marceline, Mo. : R. Wallace Pischel, 1952.)",Book,Cook book : favorite recipes,"[compiled by Friends Circle, Searboro, Iowa]",PARKS Special Collections,TX715.2 M53 C6645x 1952,1952,Item in place,Book,990015220410102756
"Book (Shenandoah, Iowa : Driftmier Publishing Co. : 1952.)","Shenandoah, Iowa : Driftmier Publishing Co. : 1952.)",Book,Kitchen-Klatter cake cook book.,,PARKS Special Collections,TX771 K59x 1952,1952,Item in place,Book,990015658280102756
"Book (Shenandoah, Iowa : Driftmier Co., 1953.)","Shenandoah, Iowa : Driftmier Co., 1953.)",Book,Kitchen-Klatter pie cook book.,,PARKS Special Collections,TX773 K562x 1953,1953,Item in place,Book,990015670780102756
"Book By Putnam Museum. Guild. (Davenport, Iowa : Putnam Museum Guild?, [date of publication not identified])","Davenport, Iowa : Putnam Museum Guild?, [date of publication not identified])",Putnam Museum. Guild.,Mrs. Putnam's pantry,Putnam Museum Guild.,PARKS General Collection,TX715.2 M53 M77x,TX715.2 M53 M77x,Item in place,Book,990014540080102756
"Book (Iowa Falls, Iowa : General Publishing and Binding, 1985.)","Iowa Falls, Iowa : General Publishing and Binding, 1985.)",Book,Cookie recipes : family favorites from here to there.,,PARKS General Collection,TX772 C39355x 1985,1985,Item in place,Book,990016259550102756
"Book By Wal-Mart Promotional Committee. ([Place of publication not identified] : [publisher not identified], 1993.)","[Place of publication not identified] : [publisher not identified], 1993.)",Wal-Mart Promotional Committee.,Wal-Mart Promotional Committee cook book.,,PARKS General Collection,TX715.2 M53 W33x 1993,1993,Item in place,Book,990018674920102756
"Book (Adair, Iowa : [publisher not identified], [1971 or 1972?])","Adair, Iowa : [publisher not identified], [1971 or 1972?])",Book,Centennial cook book.,,PARKS Special Collections,TX715.2.M53 C466x,TX715.2.M53 C466x,Item in place,Book,9921667716802756
"Book (Shenandoah, Iowa : Driftmier Co., 1955.)","Shenandoah, Iowa : Driftmier Co., 1955.)",Book,Kitchen-Klatter pudding cook book.,,PARKS Special Collections,TX773 K56x 1955,1955,Item in place,Book,990015670660102756
"Book ([Iowa?] : sl, [1986 or 1987].)","[Iowa?] : sl, [1986 or 1987].)",Book,Clay County Fair award winning recipes.,,PARKS General Collection,TX715.2 M53 C535x 1986,1986,Item in place,Book,990016221330102756
"Book By Kruse, Carolyn. (Deep River, Iowa : Brennan Printing, 1983.)","Deep River, Iowa : Brennan Printing, 1983.)","Kruse, Carolyn.",Home style microwave cooking,with Carolyn [Schneider Kruse],PARKS General Collection,TX832 H66x 1983,1983,Item in place,Book,990016224430102756
"Book By Adel Open Bible Church. (Hills, Minn. : Crescent Publishing, 1984.)","Hills, Minn. : Crescent Publishing, 1984.)",Adel Open Bible Church.,Let's break bread together,[cookbook compiled by Adel Open Bible].,PARKS General Collection,TX715.2 M53 L482x 1984,1984,Item in place,Book,990019397510102756
"Book By Ames Woman's Club (Ames, Iowa) ([Place of publication not identified] : [publisher not identified], [1923?])","Ames, Iowa) ([Place of publication not identified] : [publisher not identified], [1923?])",Ames Woman's Club,Ames Woman's Club cook book.,,PARKS Special Collections,TX715.2 M53 A48x 1923b,TX715.2 M53 A48x 1923b,Item in place,Book,990017273610102756
"Book By Stovall, William G. (Des Moines, Iowa : Wm. G. Stovall?, 1932.)","Des Moines, Iowa : Wm. G. Stovall?, 1932.)","Stovall, William G.",Jean's junior cook book,by William G. Stovall.,PARKS Special Collections,TX715.2 M53 J43x 1932,1932,Item in place,Book,990017135300102756
"Book By Kimberley Press (Urbandale, Iowa) (Urbandale, IA : Kimberley Press, [date of publication not identified])","Urbandale, Iowa) (Urbandale, IA : Kimberley Press, [date of publication not identified])",Kimberley Press,Dessert recipes from Kimberley Press & Friends.,,PARKS General Collection,TX715.2 M53 D48x,TX715.2 M53 D48x,Item in place,Book,990017699610102756
"Book By McGregor Tourist Club (McGregor, Iowa) ([McGregor, Iowa] : McGregor Tourist Club, 1924.)","McGregor, Iowa) ([McGregor, Iowa] : McGregor Tourist Club, 1924.)",McGregor Tourist Club,Tested cooky recipes,McGregor Tourist Club.,PARKS Special Collections,TX715.2 M53 T472x 1924,1924,Item in place,Book,990018674600102756
"Book By Burger, Debby. ([Place of publication not identified] : [publisher not identified], [1991])","[Place of publication not identified] : [publisher not identified], [1991])","Burger, Debby.",Cabbages and roses : favorite recipes from ten years of catering,Debby Burger.,PARKS General Collection,TX715.2 M53 B85x 1991,1991,Item in place,Book,990016431970102756
"Book (Linden, IA (1125 210th Street, Linden 50146) : [Mail orders to] Elizabeth Lundberg, [1996])","Linden, IA (1125 210th Street, Linden 50146) : [Mail orders to] Elizabeth Lundberg, [1996])",Book,Grandma Lundberg's keepsake recipes.,,PARKS General Collection,TX715.2 M53 G72x 1996,1996,Item in place,Book,990015917970102756
"Book By North Iowa Solos and Singles. (Iowa Falls, Iowa : General Publishing and Binding, 1986.)","Iowa Falls, Iowa : General Publishing and Binding, 1986.)",North Iowa Solos and Singles.,Home cooking in '86 : solo parents and singles,North Iowa Solos and Singles.,PARKS General Collection,TX715.2 M53 H658x 1986,1986,Item in place,Book,990016791180102756
"Book By Glenwood Lutheran Church (Glenwood, Iowa) (Glenwood, Iowa : Glenwood Lutheran Church?, 1965.)","Glenwood, Iowa) (Glenwood, Iowa : Glenwood Lutheran Church?, 1965.)",Glenwood Lutheran Church,Glenwood Lutheran Church cook book.,,PARKS Special Collections,TX715.2 M53 G62x 1965,1965,Item in place,Book,990016392970102756
"Book By Saint Paul's Lutheran Church (Atlantic, Iowa) (Atlantic, Iowa : St. Paul's Lutheran Church?, 1956.)","Atlantic, Iowa) (Atlantic, Iowa : St. Paul's Lutheran Church?, 1956.)",Saint Paul's Lutheran Church,Cook book.,,PARKS Special Collections,TX715.2 M53 C6626x 1956,1956,Item in place,Book,990014981570102756
"Book By Interstate Power Company. ([Cedar Rapids, Iowa] : Interstate Power Company, [1954])","[Cedar Rapids, Iowa] : Interstate Power Company, [1954])",Interstate Power Company.,Cake bake contest recipes.,,PARKS Special Collections,TX771 C237x 1954,1954,Item in place,Book,990018364840102756
"Book By Toledo Woman's Club. ([Toledo, Ohio] : Franklin Printing & Engraving Co., 1932.)","[Toledo, Ohio] : Franklin Printing & Engraving Co., 1932.)",Toledo Woman's Club.,Favorite recipes,by members of the Toledo Woman's Club.,PARKS Special Collections,TX715.2 M53 F3827x 1932,1932,Item in place,Book,990015218130102756
"Book By American Legion. Auxiliary. ([Place of publication not identified] : [publisher not identified], [1950?])","[Place of publication not identified] : [publisher not identified], [1950?])",American Legion. Auxiliary.,Cook book : over 200 selected recipes,American Legion Auxiliary.,PARKS Special Collections,TX715.2 M53 C6646x 1950,1950,Item in place,Book,990015245510102756
"Book By Republican Women's Council (Story County, Ia.) (Story County, Iowa : Republican Women's Council, 1960.)","Story County, Ia.) (Story County, Iowa : Republican Women's Council, 1960.)",Republican Women's Council,Great ones for parties.,,PARKS Special Collections,TX772 G746x 1960,1960,Item in place,Book,9920357388902756
"Book By Dubuque Packing Company. ([Dubuque, Iowa] : [Dubuque Packing Company], [between 1960 and 1969?])","[Dubuque, Iowa] : [Dubuque Packing Company], [between 1960 and 1969?])",Dubuque Packing Company.,Ham the meat for every occasion.,,PARKS Special Collections,TX749.5 H35 H35x 1960z,TX749.5 H35 H35x 1960z,Item in place,Book,990018909120102756
"Book (Shenandoah, Iowa : Driftmier Co., 1955.)","Shenandoah, Iowa : Driftmier Co., 1955.)",Book,Kitchen-Klatter frozen dessert cook book.,,PARKS Special Collections,TX795 K58x 1955,1955,Item in place,Book,990015670260102756
"Book By Grandview Little League (Grandview, Iowa). (Iowa Falls, Iowa : General Publishing and Binding, [1975])","Grandview, Iowa). (Iowa Falls, Iowa : General Publishing and Binding, [1975])",Grandview Little League,Grandview Little League cook book 75,[Grandview Little League?].,PARKS General Collection,TX715.2 M53 G735x 1975,1975,Item in place,Book,990016429930102756
"Book By First United Methodist Church (Creston, Iowa) (Iowa Falls, Iowa : General Publishing and Binding, [19--?])","Creston, Iowa) (Iowa Falls, Iowa : General Publishing and Binding, [19--?])",First United Methodist Church,The First United Methodist Church.,,PARKS Cage: Ask at Main Desk,TX715.2 M53 F577x 1900z,TX715.2 M53 F577x 1900z,Item in place,Book,9920354889702756
"Book (Jesup, Iowa : Wapsie Printing Co., [1981?])","Jesup, Iowa : Wapsie Printing Co., [1981?])",Book,Favorite recipes of the Fink family.,,PARKS General Collection,TX715.2 M53 F3824x,TX715.2 M53 F3824x,Item in place,Book,990014739770102756
"Book By Business and Professional Women's Club (Centerville, Iowa) (Centerville, Iowa : Business & Professional Women's Club, 1939.)","Centerville, Iowa) (Centerville, Iowa : Business & Professional Women's Club, 1939.)",Business and Professional Women's Club,Favorite recipes.,,PARKS Special Collections,TX715.2 M53 F3832x 1939,1939,Item in place,Book,990015277310102756
"Book By Iowa Machine Shed (Restaurant). ([Davenport, Iowa] : [Iowa Machine Shed], [between 1980 and 1989?])","Restaurant). ([Davenport, Iowa] : [Iowa Machine Shed], [between 1980 and 1989?])",Iowa Machine Shed,Great farm fixins',,PARKS General Collection,TX715.2 M53 G74x,TX715.2 M53 G74x,Item in place,Book,990016177190102756
"Book By JayCeeEttes. Millersburg Chapter. (Deep River, Iowa : Brennan Printing, 1980.)","Deep River, Iowa : Brennan Printing, 1980.)",JayCeeEttes. Millersburg Chapter.,Millersburg community cook book 1980,compiled by the Millersburg Jayceettes.,PARKS General Collection,TX715.2 M53 M55x 1980,1980,Item in place,Book,990016437620102756
"Book By Amana Society. (Amana, Iowa : Amana Society, [1978])","Amana, Iowa : Amana Society, [1978])",Amana Society.,Honey recipes from Amana,produced by The Amana Society.,PARKS General Collection,TX767 H7 H666x 1978,1978,Item in place,Book,990016738810102756
"Book By Farmersburg Study Club (Farmersburg, Iowa) ([Farmersburg, Iowa?] : Farmersburg Study Club?, [date of publication not identified])","Farmersburg, Iowa) ([Farmersburg, Iowa?] : Farmersburg Study Club?, [date of publication not identified])",Farmersburg Study Club,Our favorite recipes,Farmersburg Study Club.,PARKS Special Collections,TX715.2 M53 O9723x,TX715.2 M53 O9723x,Item in place,Book,990014895910102756
"Book ([Fayette County, Iowa?] : [publisher not identified], [date of publication not identified])","[Fayette County, Iowa?] : [publisher not identified], [date of publication not identified])",Book,News and views.,,PARKS Special Collections,TX715.2.M53 N494x,TX715.2.M53 N494x,Item in place,Book,9921515414102756
"Book By Long Creek Methodist Church (Danville, Iowa) (Iowa Falls, Iowa : General Publishing and Binding, 1975.)","Danville, Iowa) (Iowa Falls, Iowa : General Publishing and Binding, 1975.)",Long Creek Methodist Church,Favorite recipes,"Long Creek United Methodist Women, Danville, Iowa.",PARKS General Collection,TX715.2 M53 F3849x 1975,1975,Item in place,Book,990016301130102756
"Book By Gilbert Congregational Church (Gilbert, Iowa). (Iowa Falls, Iowa : General Publishing and Binding, 1977.)","Gilbert, Iowa). (Iowa Falls, Iowa : General Publishing and Binding, 1977.)",Gilbert Congregational Church,Family favorites,Gilbert Congregational Church.,PARKS General Collection,TX715.2 M53 F343x 1977,1977,Item in place,Book,990019151450102756
"Book By Iowa Power and Light Company. ([Des Moines, Iowa?] : [Iowa Power and Light Co.], [between 1900 and 1999?])","[Des Moines, Iowa?] : [Iowa Power and Light Co.], [between 1900 and 1999?])",Iowa Power and Light Company.,Holiday recipes.,,PARKS Special Collections,TX739.2 C45 H653x 1900z,TX739.2 C45 H653x 1900z,Item in place,Book,990018314980102756
"Book (Jesup, Iowa : Wapsie Printing Co., 1962.)","Jesup, Iowa : Wapsie Printing Co., 1962.)",Book,The Meier family cook book.,,PARKS Special Collections,TX715.2 M53 M45x 1962,1962,Item in place,Book,990015272960102756
"Book By First Lutheran Church (Ottumwa, Iowa) ([Ottumwa, Iowa] : [Women of First Lutheran Church], 1960.)","Ottumwa, Iowa) ([Ottumwa, Iowa] : [Women of First Lutheran Church], 1960.)",First Lutheran Church,Come into our kitchens.,,PARKS General Collection,TX715.2 M53 C6535x 1960,1960,Item in place,Book,990015723900102756
"Book By Norwegian-American Museum. (Decorah, Iowa : The Museum, 1969.)","Decorah, Iowa : The Museum, 1969.)",Norwegian-American Museum.,Pioneer cook book,compiled by volunteers of the Norwegian-American Museum.,PARKS General Collection,TX722 N6 P56x 1969,1969,Item in place,Book,990014670310102756
"Book By Blessed Sacrament Parish (Waterloo, Iowa?) (Iowa Falls, Iowa : General Publishing and Binding, 1977.)","Waterloo, Iowa?) (Iowa Falls, Iowa : General Publishing and Binding, 1977.)",Blessed Sacrament Parish,Cook book,"Blessed Sacrament Parish, [Waterloo, Iowa?].",PARKS General Collection,TX715.2 M53 C66392x 1977,1977,Item in place,Book,990016304790102756
"Book By Holy Trinity Parish (Richmond, Iowa) (Iowa City, Iowa : Best-Way Publishing, [1982?])","Richmond, Iowa) (Iowa City, Iowa : Best-Way Publishing, [1982?])",Holy Trinity Parish,Treasured recipes,"Holy Trinity Parish, Richmond, Iowa.",PARKS General Collection,TX715.2 M53 T742x 1982,1982,Item in place,Book,990016193420102756
"Book By Guttenberg Municipal Hospital (Guttenberg, Iowa). Auxiliary. (Iowa Falls, Iowa : General Publishing and Binding, 1974.)","Guttenberg, Iowa). Auxiliary. (Iowa Falls, Iowa : General Publishing and Binding, 1974.)",Guttenberg Municipal Hospital,Cooking favorites,Guttenberg Hospital Auxiliary.,PARKS General Collection,TX715.2 M53 C6727x 1974,1974,Item in place,Book,990016196750102756
"Book By St. Mary's Church (Manchester, Iowa). ([Manchester, Iowa] : Dyersville Commercial, 1973.)","Manchester, Iowa). ([Manchester, Iowa] : Dyersville Commercial, 1973.)",St. Mary's Church,Chef's delight,"St. Mary's Church, Manchester, Iowa.",PARKS Special Collections,TX715.2 M53 C52x 1973,1973,Item in place,Book,990015140620102756
