Type / Creator / Imprint,Publisher,Author,Title,Extra Title Info,Permanent Location,Call Number,Date,Status,Material Type,MMS ID
"Book By Killian Co. (Cedar Rapids, Iowa). Employees, ([Cedar Rapids, Iowa] [Killian's employees], [1972])","Cedar Rapids, Iowa). Employees, ([Cedar Rapids, Iowa] [Killian's employees], [1972])",Killian Co.,Killian's employees cook book.,,PARKS Special Collections,TX715.2.M53 K555 1972,1972,Item in place,,9921188516702756
"Book By Women's Society of Christian Service (Delta Methodist Church (Delta, Iowa)) (Delta, Iowa : [Delta Methodist Church?], [1948?])","Delta Methodist Church (Delta, Iowa)) (Delta, Iowa : [Delta Methodist Church?], [1948?])",Women's Society of Christian Service,Cook book : favorite recipes,"[compiled by Delta Church W.S.C.S., Delta, Iowa].",PARKS Special Collections,TX715.2 M53 C6647x 1948,1948,Item in place,Book,990015272610102756
"Book By American Lutheran Church Women (Marion, Iowa) (Decorah, Iowa : Amundsen, 1963.)","Marion, Iowa) (Decorah, Iowa : Amundsen, 1963.)",American Lutheran Church Women,A book of favorite recipes,compiled by Marion American Lutheran Church Women.,PARKS Special Collections,TX715.2 M53 B6624x 1963,1963,Item in place,Book,990014985050102756
"Book By Methodist Church (Hazelton, Iowa). Women's Society of Christian Service. (Hazelton, Iowa : W.S.C. of Methodist Church, [between 1950 and 1959?])","Hazelton, Iowa). Women's Society of Christian Service. (Hazelton, Iowa : W.S.C. of Methodist Church, [between 1950 and 1959?])",Methodist Church,Suburban cookie book,"sponsored by W.S.C. of Methodist Church, Hazelton, Iowa.",PARKS Special Collections,TX772 S832x 1950z,TX772 S832x 1950z,Item in place,Book,990018239970102756
"Book By National Live Stock and Meat Board. (Chicago, Ill. : National Live Stock and Meat Board, [1934])","Chicago, Ill. : National Live Stock and Meat Board, [1934])",National Live Stock and Meat Board.,Tempting meat recipes.,,PARKS Special Collections,TX749 T426x 1934,1934,Item in place,Book,990018902900102756
"Book By Douglas Avenue Presbyterian Church (Des Moines, Iowa). Junior High Fellowship. (Des Moines, Iowa : Junior High Fellowship of United Presbyterian Youth of Douglas Avenue Church, [1968?])","Des Moines, Iowa). Junior High Fellowship. (Des Moines, Iowa : Junior High Fellowship of United Presbyterian Youth of Douglas Avenue Church, [1968?])",Douglas Avenue Presbyterian Church,What's cooking? at Douglas Avenue Presbyterian Church,[Junior High Fellowship of United Presbyterian Youth of Douglas Avenue Church],PARKS Special Collections,TX715.2 M53 W53x 1968,1968,Item in place,Book,990014636760102756
"Book By Friends' Church (Oskaloosa, Iowa). Women of the Friends' Building Association. (Oskaloosa, Iowa : Saturday Globe, 1902.)","Oskaloosa, Iowa). Women of the Friends' Building Association. (Oskaloosa, Iowa : Saturday Globe, 1902.)",Friends' Church,Friends' cook book,"a publication compiled by the Women of the Friends' Building Association of the Friends' Church Oskaloosa, Iowa.",PARKS Special Collections,TX715.2 M53 F75x 1902,1902,Item in place,Book,990014640040102756
"Book By Congregational United Church of Christ (Denmark, Iowa). Plymouth Circle. (Denmark, Iowa : Plymouth Circle of the Denmark Congregational United Church of Christ, 1964.)","Denmark, Iowa). Plymouth Circle. (Denmark, Iowa : Plymouth Circle of the Denmark Congregational United Church of Christ, 1964.)",Congregational United Church of Christ,"""Favorite recipes"" tried and true",compiled by Plymouth Circle of the Denmark Congregational United Church of Christ.,PARKS Special Collections,TX715.2 M53 F3822x 1964,1964,Item in place,Book,990014636590102756
"Book By Willing Workers Society (Frankville Community Church (Winneshiek County, Iowa)) ([Place of publication not identified] : [publisher not identified], [1936])","Frankville Community Church (Winneshiek County, Iowa)) ([Place of publication not identified] : [publisher not identified], [1936])",Willing Workers Society,When do we eat?,"[compiled by Division One of Willing Workers, Frankville Community Church, Winneshiek County, Iowa]",PARKS Special Collections,TX715.2 M53 W54x 1936,1936,Item in place,Book,990014893290102756
"Book By First United Methodist Church (Ames, Iowa) (Audubon, Iowa : Jumbo Jack's Cookbooks, 2003.)","Ames, Iowa) (Audubon, Iowa : Jumbo Jack's Cookbooks, 2003.)",First United Methodist Church,Treasured recipes,"First United Methodist Women, Ames, Iowa.",PARKS General Collection,TX715.2 M53 T744x 2003,2003,Item in place,Book,990016737810102756
"Book By East Clermont Lutheran Church (Clermont, Iowa) ([Clermont, Iowa] : [East Clermont American Lutheran Church Women?], 1966.)","Clermont, Iowa) ([Clermont, Iowa] : [East Clermont American Lutheran Church Women?], 1966.)",East Clermont Lutheran Church,East Clermont Lutheran cook book,[compiled by the American Lutheran Church Women],PARKS Special Collections,TX715.2 M53 E272x 1966,1966,Item in place,Book,990015141710102756
"Book By Congregational United Church of Christ (Denmark, Iowa). Plymouth Circle. (Iowa Falls, Iowa : General Publishing and Binding, 1977.)","Denmark, Iowa). Plymouth Circle. (Iowa Falls, Iowa : General Publishing and Binding, 1977.)",Congregational United Church of Christ,"""Favorite recipes"" tried and true",compiled by Plymouth Circle of the Denmark Congregational United Church of Christ.,PARKS Special Collections,TX715.2 M53 F3822x 1977,1977,Item in place,Book,990016745070102756
"Book By First Christian Reformed Church (Wellsburg, Iowa) Queen Esther Circle. (Wellsburg, Iowa : 1st Christian Reformed Church?, [date of publication not identified])","Wellsburg, Iowa) Queen Esther Circle. (Wellsburg, Iowa : 1st Christian Reformed Church?, [date of publication not identified])",First Christian Reformed Church,Favorite recipes,"compiled by Queen Esther Circle, 1st Christian Reformed Church, Wellsburg, Iowa.",PARKS General Collection,TX715.2 M53 F3858x,TX715.2 M53 F3858x,Item in place,Book,990017375790102756
"Book By Fellowship Christian Center (Cedar Rapids, Iowa). (Shawnee Mission, Kan. : Circulation Service, 1984.)","Cedar Rapids, Iowa). (Shawnee Mission, Kan. : Circulation Service, 1984.)",Fellowship Christian Center,A book of favorite recipes,compiled by Fellowship Christian Center and School.,PARKS General Collection,TX715.2 M53 B6639x 1984,1984,Item in place,Book,990016432220102756
"Book By Jefferson Band Parents Association (Cedar Rapids, Iowa). (Audubon, Iowa : Jumbo Jack's Cookbooks, 1992.)","Cedar Rapids, Iowa). (Audubon, Iowa : Jumbo Jack's Cookbooks, 1992.)",Jefferson Band Parents Association,Cooking with the Band of Blue,"Jefferson Band Parents Association, Cedar Rapids, Iowa.",PARKS General Collection,TX715.2 M53 C6734x 1992,1992,Item in place,Book,990018656010102756
"Book By Iowa. Department of Social Services. Food Programs Office. ([Des Moines, Iowa] : Iowa Dept. of Social Services, Food Programs Office, [1979?])","[Des Moines, Iowa] : Iowa Dept. of Social Services, Food Programs Office, [1979?])",Iowa. Department of Social Services. Food Programs Office.,Low cost meals and recipes,"DSS, Iowa Dept. of Social Services, Food Programs Office.",PARKS General Collection,TX652 L693x 1979,1979,Item in place,Book,990018876930102756
"Book By Lutheran Home. Auxiliary (Vinton, Iowa) (Vinton, Iowa : Lutheran Home Auxiliary, 1981.)","Vinton, Iowa) (Vinton, Iowa : Lutheran Home Auxiliary, 1981.)",Lutheran Home. Auxiliary,Sampler #1 : featuring 65 favorite recipes,"by residents of the Lutheran Home, Vinton, Iowa.",PARKS General Collection,TX715.2 M53 S359x 1981,1981,Item in place,Book,990019000830102756
"Book By Ames Business and Professional Women's Club. (Ames, Iowa : Business & Professional Women's Club, 1960.)","Ames, Iowa : Business & Professional Women's Club, 1960.)",Ames Business and Professional Women's Club.,Recipes by and for those who like to cook,[prepared by Ames Business and Professional Women's Club],PARKS Special Collections,"TX715 R285x, 1960",1960,Item in place,Book,990010936330102756
"Book By Meadow Star United Methodist Church (Washta, Iowa) (Leawood, Kan. : Circulation Service, Inc., [1985])","Washta, Iowa) (Leawood, Kan. : Circulation Service, Inc., [1985])",Meadow Star United Methodist Church,A book of favorite recipes,compiled by members and friends of the Meadow Star United Methodist Church.,PARKS General Collection,TX715.2 M53 B6637x 1985,1985,Item in place,Book,990016247160102756
"Book By Iowa Egg Council. (Ames, Iowa : Iowa Egg Council, [between 1980 and 1989?])","Ames, Iowa : Iowa Egg Council, [between 1980 and 1989?])",Iowa Egg Council.,The incredible edible egg in food service.,,PARKS General Collection,TX745 I53x 1980z,TX745 I53x 1980z,Item in place,Book,990018376700102756
"Book By Lutheran Retirement Home (Northwood, Iowa) (Waverly, IA : G & R Pub. Co., 2001.)","Northwood, Iowa) (Waverly, IA : G & R Pub. Co., 2001.)",Lutheran Retirement Home,"Memories, mementos, and morning-glory moments","Lutheran Retirement Home, Northwood, IA.",PARKS General Collection,TX715.2 M53 M46x 2001,2001,Item in place,Book,990015984710102756
"Book By St. John's Catholic Church (Waterloo, Iowa). Rosary Society. (Kansas City, Mo. : Bev-Ron Publishing Company, 1960.)","Waterloo, Iowa). Rosary Society. (Kansas City, Mo. : Bev-Ron Publishing Company, 1960.)",St. John's Catholic Church,St. John's Catholic Church cook book,"compiled by the members of St. John's Rosary Society, Waterloo, Iowa.",PARKS Special Collections,TX715.2 M53 S252x 1960,1960,Item in place,Book,990015129030102756
"Book By Congregational United Church of Christ (Denmark, Iowa). Plymouth Circle. (Iowa City, Iowa : Best-Way Publishing, 1982.)","Denmark, Iowa). Plymouth Circle. (Iowa City, Iowa : Best-Way Publishing, 1982.)",Congregational United Church of Christ,"""Favorite recipes"" tried and true","compiled by Plymouth Circle of the Congregational United Church of Christ, Denmark, Iowa.",PARKS General Collection,TX715.2 M53 F3822x 1982,1982,Item in place,Book,990016744800102756
"Book By American Legion. Auxiliary. Lash-Jordon. No. 533 (What Cheer, Iowa) (Marceline, Mo. : Walsworth, 1955.)","What Cheer, Iowa) (Marceline, Mo. : Walsworth, 1955.)",American Legion. Auxiliary. Lash-Jordon. No. 533,Cook book,"compiled by American Legion Auxiliary, What Cheer, Iowa.",PARKS Special Collections,TX715.2 M53 C662x 1955,1955,Item in place,Book,990014722880102756
"Book By Women's Society for Christian Service (Packwood, Iowa) ([Packwood, Iowa] : [Women's Society for Christian Service?], [date of publication not identified])","Packwood, Iowa) ([Packwood, Iowa] : [Women's Society for Christian Service?], [date of publication not identified])",Women's Society for Christian Service,The art of cooking in Packwood,"Women's Society for Christian Service, Packwood, Iowa.",PARKS Special Collections,TX715.2 M53 A78x,TX715.2 M53 A78x,Item in place,Book,990015170050102756
"Book By First United Presbyterian Church (Fairfield, Iowa). ([Fairfield, Iowa] : First Presbyterian Church, [1960-1970?])","Fairfield, Iowa). ([Fairfield, Iowa] : First Presbyterian Church, [1960-1970?])",First United Presbyterian Church,A book of favorite recipes,"compiled by members and friends of the First United Presbyterian Church, Fairfield, Iowa.",PARKS General Collection,TX715.2 M53 B6638x 1960,1960,Item in place,Book,990016395680102756
"Book By First Congregational Church (Forest City, Iowa) (Audubon, Iowa : Jumbo Jack's, 1996.)","Forest City, Iowa) (Audubon, Iowa : Jumbo Jack's, 1996.)",First Congregational Church,125th anniversary celebration cook book,"First Congregational Church, Forest City, Iowa.",PARKS General Collection,TX715.2 M53 A172x 1996,1996,Item in place,Book,990018672570102756
"Book By Swedesburg Evangelical  Lutheran Church (Swedesburg, Iowa). Ladies Aid Society. (Swedesburg, Iowa : Ladies Aid Society, Swedesburg Evangelical Lutheran Church, 1927.)","Swedesburg, Iowa). Ladies Aid Society. (Swedesburg, Iowa : Ladies Aid Society, Swedesburg Evangelical Lutheran Church, 1927.)",Swedesburg Evangelical  Lutheran Church,Swedesburg cook book.,,PARKS Special Collections,TX715.2 M53 S94x 1927,1927,Item in place,Book,9920357690002756
"Book By American Legion. Auxiliary. Unit No. 317 (Radcliffe, Iowa) (Marceline, Mo. : Walsworth Brothers, 1951.)","Radcliffe, Iowa) (Marceline, Mo. : Walsworth Brothers, 1951.)",American Legion. Auxiliary. Unit No. 317,Cook book,"compiled by Radcliffe American Legion Auxiliary, Unit No. 317, Radcliffe, Iowa.",PARKS Special Collections,TX715.2 M53 C66396x 1951,1951,Item in place,Book,990018582060102756
"Book By Methodist Church (Colo, Iowa) (Colo, Iowa : Women's Society of Christian Service?, 1955.)","Colo, Iowa) (Colo, Iowa : Women's Society of Christian Service?, 1955.)",Methodist Church,Colo's favorite recipes,"Women's Society of Christian Service, Methodist Church, Colo, Iowa.",PARKS Special Collections,TX715.2 M53 C6532x 1955,1955,Item in place,Book,990016184910102756
"Book By Iowa State Policemen's Association. Auxiliary. ([Place of publication not identified] : Iowa State Policemen's Association Auxiliary, 1983.)","[Place of publication not identified] : Iowa State Policemen's Association Auxiliary, 1983.)",Iowa State Policemen's Association. Auxiliary.,Cooks behind the cops,by I.S.P.A.A.,PARKS General Collection,TX715.2 M53 C6772x 1983,1983,Item in place,Book,990015723610102756
"Book By Young, Jessie S. ([Shenandoah, Iowa] : [KMA Radio?], 1941.)","[Shenandoah, Iowa] : [KMA Radio?], 1941.)","Young, Jessie S.",Jessie's pie and bread book,edited by Jessie S. Young.,PARKS Special Collections,TX773 J47x 1941,1941,Item in place,Book,990015583350102756
"Book By St. John's Evangelical and Reformed Church (Ackley, Iowa). Crescent Club. (Ackley, Iowa : Crescent Club of St. John's Evangelical and Reformed Church?, 1946.)","Ackley, Iowa). Crescent Club. (Ackley, Iowa : Crescent Club of St. John's Evangelical and Reformed Church?, 1946.)",St. John's Evangelical and Reformed Church,Cook book,"compiled by Crescent Club of St. John's Evangelical and Reformed Church, Ackley, Iowa.",PARKS Special Collections,TX715.2 M53 C6625x 1946,1946,Item in place,Book,990014984910102756
"Book By United Methodist Church (New Sharon, Iowa) (New Sharon, Iowa : United Methodist Church, [1981?])","New Sharon, Iowa) (New Sharon, Iowa : United Methodist Church, [1981?])",United Methodist Church,Butter 'n love recipes,"United Methodist Church, New Sharon, Iowa.",PARKS General Collection,TX715.2 M53 B8872x 1981,1981,Item in place,Book,990015734390102756
"Book By Lacey Methodist Church (Lacey, Iowa). Women's Society of Christian Service. ([Lacey, Iowa] : [W.S.C.S. of the Lacey Methodist Church?], 1952.)","Lacey, Iowa). Women's Society of Christian Service. ([Lacey, Iowa] : [W.S.C.S. of the Lacey Methodist Church?], 1952.)",Lacey Methodist Church,Cook book,"compiled by the W.S.C.S. of the Lacey Methodist Church, Lacey, Iowa.",PARKS Special Collections,TX715.2 M53 C6629x 1952,1952,Item in place,Book,990015048330102756
"Book By St. Mary of Nazareth (Des Moines, Iowa) Rosary Society. (Des Moines, Iowa : St. Mary of Nazareth?, 1969.)","Des Moines, Iowa) Rosary Society. (Des Moines, Iowa : St. Mary of Nazareth?, 1969.)",St. Mary of Nazareth,Salad and casserole favorites,"[compiled by St. Mary of Nazareth Rosary Society, Des Moines, Iowa]",PARKS General Collection,TX715.2 M53 S34x 1969,1969,Item in place,Book,990015189080102756
"Book By Orange City Christian School. Monica Society. (Orange City, Iowa : Pluim Publishing, [1981])","Orange City, Iowa : Pluim Publishing, [1981])",Orange City Christian School. Monica Society.,Select recipes : calling all cooks : 100's of favorites,"compiled by The Monica Society, Orange City Christian School.",PARKS General Collection,TX715.2 M53 S45x 1981,1981,Item in place,Book,990016340190102756
"Book By American Lutheran Church Women (Norwalk, Iowa) (Norwalk, Iowa : New Life Lutheran Church?, [between 1970 and 1979?])","Norwalk, Iowa) (Norwalk, Iowa : New Life Lutheran Church?, [between 1970 and 1979?])",American Lutheran Church Women,New Life Lutheran Church cook book,[New Life Lutheran ALCW],PARKS General Collection,TX715.2 M53 N47x 1970,1970,Item in place,Book,990016259370102756
"Book By First Congregational Church (Charles City, Iowa). Women's Fellowship. (Iowa Falls, Iowa : General Publishing and Binding, 1975.)","Charles City, Iowa). Women's Fellowship. (Iowa Falls, Iowa : General Publishing and Binding, 1975.)",First Congregational Church,Cook book,"compiled by Women's Fellowship, First Congregational Church of the United Church of Christ, Charles City, Iowa.",PARKS General Collection,TX715.2 M53 C66226x 1975,1975,Item in place,Book,990016366350102756
"Book By St. Mary's of Mt. Carmel Catholic Church (Waterloo, Iowa) St. Elizabeth's Rosary Society. (LaPorte City, Iowa : Office Advantage, 1992.)","Waterloo, Iowa) St. Elizabeth's Rosary Society. (LaPorte City, Iowa : Office Advantage, 1992.)",St. Mary's of Mt. Carmel Catholic Church,Company's coming,[St. Elizabeth's Rosary Society],PARKS General Collection,TX715.2 M53 C6543x 1992,1992,Item in place,Book,990014683320102756
"Book By St. Elias the Prophet Greek Orthodox Church (Dubuque, Iowa). Philoptochos Society. (Dubuque, Iowa : [Philoptochos Society], [date of publication not identified])","Dubuque, Iowa). Philoptochos Society. (Dubuque, Iowa : [Philoptochos Society], [date of publication not identified])",St. Elias the Prophet Greek Orthodox Church,Easy Greek recipes,"[compiled by the Philoptochos Society of the Greek Orthodox Community, St. Elias of Dubuque, Iowa]",PARKS Special Collections,TX723.5 G8 E28x,TX723.5 G8 E28x,Item in place,Book,990015247580102756
"Book By Christ the King Lutheran Church (Iowa City, Iowa) (Iowa City, Iowa : Christ the King Lutheran Church, [1975])","Iowa City, Iowa) (Iowa City, Iowa : Christ the King Lutheran Church, [1975])",Christ the King Lutheran Church,Love to you and yours : Christmas carousel recipes 1975.,,PARKS General Collection,TX739.2 C45 L68x 1975,1975,Item in place,Book,990018312940102756
"Book By Central College (Pella, Iowa). Women's Auxiliary. (Pella, Iowa : Pella Chronicle, 1974.)","Pella, Iowa). Women's Auxiliary. (Pella, Iowa : Pella Chronicle, 1974.)",Central College,Dat is lekker kookboek,compiled and published by the Women's Auxiliary of Central College.,PARKS General Collection,TX715.2 M53 D38x 1974,1974,Item in place,Book,990016312480102756
"Book By Methodist Church (Shenandoah, Iowa) (Kansas City, Mo. : North American Press, [1963?])","Shenandoah, Iowa) (Kansas City, Mo. : North American Press, [1963?])",Methodist Church,Tried and true recipes,"Methodist W.S.C.S., Shenandoah, Iowa.",PARKS Special Collections,TX715.2 M53 T7535x 1963,1963,Item in place,Book,990018239890102756
"Book By Center Chapel United Methodist Church (Indianola, Iowa) Women's Society of Christian Service. (Iowa Falls, Iowa : General Publishing and Binding, 1969.)","Indianola, Iowa) Women's Society of Christian Service. (Iowa Falls, Iowa : General Publishing and Binding, 1969.)",Center Chapel United Methodist Church,Cooking with Center Chapel,[compiled by Center Chapel W.S.C.S.],PARKS Special Collections,TX715.2 M53 C67335x 1969,1969,Item in place,Book,990018971470102756
"Book By Henry Field Seed & Nursery Co. (Shenandoah, Iowa : Print Shop of the Henry Field Seed Company, [1920?])","Shenandoah, Iowa : Print Shop of the Henry Field Seed Company, [1920?])",Henry Field Seed & Nursery Co.,Your KFNF radio cook book : best by test,compiled by Leanna Field Driftmier.,PARKS Special Collections,TX715.2 M53 Y68x 1920,1920,Item in place,Book,990014640030102756
"Book By Des Moines Women's Club. ([Place of publication not identified] : [publisher not identified], 1956.)","[Place of publication not identified] : [publisher not identified], 1956.)",Des Moines Women's Club.,From the kitchens of Hoyt Sherman Place,[Des Moines Women's Club],PARKS Special Collections,TX715.2 M53 F762x 1956,1956,Item in place,Book,990015256040102756
"Book By Scheiber, Linda. (West Branch, Iowa : Scattergood Friends School?, 1983.)","West Branch, Iowa : Scattergood Friends School?, 1983.)","Scheiber, Linda.",Everyday cooking from the kitchen of Scattergood Friends School,recipes compiled and reduced by Linda Scheiber ; calligraphy and drawings by Maxine Fredericksen.,PARKS General Collection,TX715.2 M53 E915x 1983,1983,Item in place,Book,990016423880102756
"Book By SS Peter and Paul Church (Sherrill, Iowa) (Shawnee Mission, Kan. : Circulation Service, [1982])","Sherrill, Iowa) (Shawnee Mission, Kan. : Circulation Service, [1982])",SS Peter and Paul Church,A book of favorite recipes,compiled by S.S. Peter and Paul Altar and Rosary Society.,PARKS General Collection,TX715.2 M53 B6645x 1982,1982,Item in place,Book,990016738900102756
"Book By Panora Nursing and Rehab Center (Panora, Iowa). Auxiliary. (Audubon, Iowa : Jumbo Jack's Cookbooks, 1998.)","Panora, Iowa). Auxiliary. (Audubon, Iowa : Jumbo Jack's Cookbooks, 1998.)",Panora Nursing and Rehab Center,"Favorite recipes from past and present residents and families, staff and volunteers","compiled by Panora Nursing and Rehab Center Auxiliary of Panora, Iowa.",PARKS General Collection,TX715.2 M53 F3844x 1998,1998,Item in place,Book,990016273340102756
"Book By Methodist Church (Blakesburg, Iowa). Woman's Society of Christian Service. (Blakesburg, Iowa : Woman's Society of Christian Service of the Methodist Church, 1950.)","Blakesburg, Iowa). Woman's Society of Christian Service. (Blakesburg, Iowa : Woman's Society of Christian Service of the Methodist Church, 1950.)",Methodist Church,Cook book,compiled by Woman's Society of Christian Service of the Methodist Church.,PARKS General Collection,TX715.2 M53 C6622x 1950,1950,Item in place,Book,990015756420102756
"Book By P.E.O. Sisterhood. Chapter CV (Corning, Iowa) (Winnipeg, Canada : Gateway Publishing Co. LTD., [19--])","Corning, Iowa) (Winnipeg, Canada : Gateway Publishing Co. LTD., [19--])",P.E.O. Sisterhood. Chapter CV,From our... kitchen... to yours.,,PARKS Special Collections,TX715.2.M53 F853x,TX715.2.M53 F853x,Item in place,Book,9921562316902756
"Book By United Methodist Women (Fremont, Iowa) (Kearney, Neb. : Cookbooks by Morris Press, 1988.)","Fremont, Iowa) (Kearney, Neb. : Cookbooks by Morris Press, 1988.)",United Methodist Women,Flavors of Fremont,"[compiled by United Methodist Women], Fremont United Methodist Church.",PARKS General Collection,TX715.2 M53 F576x 1988,1988,Item in place,Book,990016190680102756
"Book By Congregational United Church of Christ (Denmark, Iowa). Plymouth Circle. (Iowa Falls, Iowa : General Publishing and Binding, 1988.)","Denmark, Iowa). Plymouth Circle. (Iowa Falls, Iowa : General Publishing and Binding, 1988.)",Congregational United Church of Christ,"""Favorite recipes"" tried and true",compiled by Plymouth Circle of the Denmark Congregational United Church of Christ.,PARKS General Collection,TX715.2 M53 F3822x 1988,1988,Item in place,Book,990016178660102756
"Book By L'MAJ Herbs and Spices. (Steamboat Rock, Iowa : L'MAJ Herbs and Spices, [1984?])","Steamboat Rock, Iowa : L'MAJ Herbs and Spices, [1984?])",L'MAJ Herbs and Spices.,L'MAJ cuisine for creative cooks.,,PARKS Special Collections,TX819 H4 L63x 1984,1984,Item in place,Book,990018971290102756
"Book By Iowa Dairy Industry Commission. ([Iowa] : Iowa Dairy Industry Commission, [between 1950 and 1959?])","[Iowa] : Iowa Dairy Industry Commission, [between 1950 and 1959?])",Iowa Dairy Industry Commission.,Cookery fun with dairy foods,"compiled by the home economics staff, Iowa Dairy Industry Commission.",PARKS Special Collections,TX759 C64x 1950z,TX759 C64x 1950z,Item in place,Book,990019720720102756
"Book By St. John's Catholic Church (Delhi, Iowa). Young Married Couples Club. (Dubuque, Iowa : Hoermann Press, 1952.)","Delhi, Iowa). Young Married Couples Club. (Dubuque, Iowa : Hoermann Press, 1952.)",St. John's Catholic Church,Favorite recipes,"[compiled by Young Married Couples Club of St. John's Catholic Church of Delhi, Iowa]",PARKS Special Collections,TX715.2 M53 F3826x 1952,1952,Item in place,Book,990015040180102756
"Book By St. Paul's United Church of Christ (Cedar Falls, Iowa) (Pleasanton, KS : Fundcraft Publishing, Inc., [1981])","Cedar Falls, Iowa) (Pleasanton, KS : Fundcraft Publishing, Inc., [1981])",St. Paul's United Church of Christ,Favorite recipes,"St. Paul's United Church of Christ, Mt. Vernon [Township], Cedar Falls, Iowa.",PARKS General Collection,TX715.2 M53 F3842x 1981,1981,Item in place,Book,990016211390102756
"Book By Loyal Order of Moose. Women of the Moose. Chapter #870 (Mason City, Iowa) (Iowa Falls, Iowa : General Publishing and Binding, 1970.)","Mason City, Iowa) (Iowa Falls, Iowa : General Publishing and Binding, 1970.)",Loyal Order of Moose. Women of the Moose. Chapter #870,Favorite recipes,"compiled by Women of the Moose, Chapter 870, Mason City, Iowa.",PARKS General Collection,TX715.2 M53 F3846x 1970,1970,Item in place,Book,990016259460102756
"Book By Soil Conservation Society of America. Iowa Chapter, ([Des Moines, Iowa?] : [Soil Conservation Society of America, Iowa Chapter?], [1967?])","[Des Moines, Iowa?] : [Soil Conservation Society of America, Iowa Chapter?], [1967?])","Soil Conservation Society of America. Iowa Chapter,",Conservationists' cuisine.,,PARKS Special Collections,TX715.2.M53 C661x 1967,1967,Item in place,Book,9921515414302756
"Book By Plymouth Congregational Church (Des Moines, Iowa) (Des Moines, Iowa : Plymouth Congregational United Church of Christ, 1976.)","Des Moines, Iowa) (Des Moines, Iowa : Plymouth Congregational United Church of Christ, 1976.)",Plymouth Congregational Church,'76 : a cook book,edited by the Women of Plymouth Church.,PARKS General Collection,TX715.2 M53 A165x 1976,1976,Item in place,Book,990015724570102756
